title,company,location,link
ImFusion GmbH, München," Computer Vision, Image Guided Surgery, Medical Imaging",https://stackoverflow.com//jobs/companies/imfusion-gmbh?c=G4zcafjWAwjWpYU8&q=python
"Cipher Tech Solutions, Inc", Elkridge; Linthicum Heights; Vienna, Computer Software,https://stackoverflow.com//jobs/companies/cipher-tech-solutions-inc?c=4OhVpDyWPrknQjFS&q=python
Stardog Union, Arlington," Databases, Enterprise Software, Information Technology",https://stackoverflow.com//jobs/companies/Stardog-Union?c=y69d7xMTEOoXdd8k&q=python
FINN, München," Agile Software Development, Automotive, Mobility",https://stackoverflow.com//jobs/companies/finn?c=MoDdZTBXzfccxfq0&q=python
Creative Assembly, Horsham; Bulgaria," Computer Games, PC Games",https://stackoverflow.com//jobs/companies/creative-assembly?c=Kad4Mntrp9p2VGP6&q=python
IMS, Crewe; Waterloo; Manchester," Automotive, Insurance, Software Development",https://stackoverflow.com//jobs/companies/ims1?c=OD3ndpKtJkZm8O0U&q=python
atma.io , Graz; Zagreb; Leinfelden-Echterdingen," Cloud-Based Solutions, Information Technology, SaaS",https://stackoverflow.com//jobs/companies/atmaio?c=OxiN7j88ETWjfL8s&q=python
LeoVegas Mobile Gaming Group, Stockholm; Västerås; Växjö," Casino, Gaming",https://stackoverflow.com//jobs/companies/leovegas-mobile-gaming-group?c=LclShHGZH6k8RHoI&q=python
CARIAD , Nürnberg; Wolfsburg; Mönsheim," Agile Software Development, Autonomous Driving, Computer Vision",https://stackoverflow.com//jobs/companies/cariad?c=OEdTMhDz4cPt28z6&q=python
Baker Hughes, Houston; Cramlington; Groby, Software Development / Engineering,https://stackoverflow.com//jobs/companies/baker-hughes?c=OzPVFwyuyrVybDZS&q=python
ZEISS Group, München; Oberkochen; Jena," Machine Learning, Medical Devices, Virtual Reality",https://stackoverflow.com//jobs/companies/zeiss-group?c=wSZsZcs7hw9jnaco&q=python&pg=2
Breuninger GmbH & Co., Düsseldorf; Stuttgart," E-Commerce, Information Technology, Retail",https://stackoverflow.com//jobs/companies/breuninger-gmbh-co?c=AE472SJw62RXGXAs&q=python&pg=2
Picnic, Düsseldorf; Amsterdam," E-Commerce, Information Technology, Logistics and Supply Chain",https://stackoverflow.com//jobs/companies/picnic?c=mvUJNSg2ZCkHfGvu&q=python&pg=2
Copado Strategic Services, San Francisco," Cybersecurity, DevOps, Internet Infrastructure",https://stackoverflow.com//jobs/companies/copado-strategic-services?c=lodrCV4kR2FzzQOs&q=python&pg=2
Catawiki, Assen; Amsterdam, eCommerce,https://stackoverflow.com//jobs/companies/catawiki?c=gtoApgik3V46wogw&q=python&pg=2
Chan Zuckerberg Initiative, Redwood City," Computer Software, Education Technology, Science",https://stackoverflow.com//jobs/companies/chan-zuckerberg-initiative?c=NOQPKhmRRU05lab6&q=python&pg=2
IMC Trading, Amsterdam; Chicago; The Rocks," Capital Markets, Financial Technology, High Frequency Trading",https://stackoverflow.com//jobs/companies/imc-trading?c=btZFEmN3xefHtdok&q=python&pg=2
Motius GmbH, München; Stuttgart; Dubai," Electronics, Software Development / Engineering, Web Development",https://stackoverflow.com//jobs/companies/motius-gmbh?c=npLOESqUjAdvmLle&q=python&pg=2
Rheinmetall , Bremen; Düsseldorf," Cybersecurity, Defence & Security, Software Development / Engineering",https://stackoverflow.com//jobs/companies/rheinmetall-group?c=FbinAG5CVZmbKzlu&q=python&pg=2
ING Deutschland, Frankfurt am Main; Nürnberg," Banking, Finance, Financial Technology",https://stackoverflow.com//jobs/companies/ing-deutschland?c=ia5AK3jwGDN3oyCQ&q=python&pg=2
MUFG, Phoenix; Charlotte; Dallas," Banking, Financial Services, Financial Technology",https://stackoverflow.com//jobs/companies/mufg?c=OCFcmss7hInjQmuQ&q=python&pg=3
Assurance, Toronto; Seattle; Fort Lauderdale," Financial Services, Insurance",https://stackoverflow.com//jobs/companies/assurance?c=Og95xe6d3uWGaenC&q=python&pg=3
Adyen., Madrid; Chicago; Amsterdam," Financial Services, Financial Technology, Payment Network",https://stackoverflow.com//jobs/companies/adyen?c=OKmEJlygAguydCXC&q=python&pg=3
Y42, Ho Chi Minh City; Berlin; Albania," Data & Analytics, Databases, Information Technology",https://stackoverflow.com//jobs/companies/y42?c=OHrlkaPyf5TgZiA8&q=python&pg=3
Enveil, Fulton," Business to Business, Security Software",https://stackoverflow.com//jobs/companies/enveil?c=H6BWXkIpgz5wMnBe&q=python&pg=3
AllTrails, San Francisco, Health & Fitness,https://stackoverflow.com//jobs/companies/alltrails?c=OpjcBHyIwDmy9F28&q=python&pg=3
Yoco, Cape Town; Amsterdam; Johannesburg, Financial Technology,https://stackoverflow.com//jobs/companies/yoco?c=OJYtSofU8DSvVbry&q=python&pg=3
Udemy, Mountain View; Austin; Denver," Education Technology, SaaS",https://stackoverflow.com//jobs/companies/udemy?c=OJodAXjmtcXstwas&q=python&pg=3
Adference GmbH, Lüneburg," E-Commerce, Online Advertising, SaaS",https://stackoverflow.com//jobs/companies/adference-gmbh?c=LQ7JpfTV8CTVcY9i&q=python&pg=3
"Sailpoint Technologies, Inc.", Austin," Information Technology, IT Security, Network Security",https://stackoverflow.com//jobs/companies/sailpoint-technologies-inc?c=Jp1TqEDDuNayVZfi&q=python&pg=3
Thermo Fisher Scientific Careers, Hyderabad; Budapest; Austin," Biotechnology, Pharmaceuticals, Science",https://stackoverflow.com//jobs/companies/thermo-fisher-scientific-careers?c=OIpMsz4sm9qmJpni&q=python&pg=4
Inductive Automation , Folsom," Industrial Automation, SCADA",https://stackoverflow.com//jobs/companies/inductive-automation?c=OKsHrAnmcaE3NeQ8&q=python&pg=4
Fullscript, Ottawa; Scottsdale," Computer Software, eCommerce, Health Care",https://stackoverflow.com//jobs/companies/fullscript?c=finNYb5x8ybFjMFW&q=python&pg=4
ASML, Chandler; Veldhoven; East District," Hardware Development, Semiconductors, Software Development / Engineering",https://stackoverflow.com//jobs/companies/asml?c=o64OkE4bEEMwDUXe&q=python&pg=4
SpotMe, Sofia; Lausanne," Enterprise Software, SaaS, Virtual Events",https://stackoverflow.com//jobs/companies/spotme?c=9KnlUp38zkXHSY8&q=python&pg=4
Geotab, No office location," Internet of Things, Software Development / Engineering, Telematics",https://stackoverflow.com//jobs/companies/geotab?c=LpjHbvi20yISfXlm&q=python&pg=4
The Home Depot, No office location," Retail, Technical Services, Web Technology",https://stackoverflow.com//jobs/companies/the-home-depot?c=OHxo2pEDR02MyUsE&q=python&pg=4
Capital Group, San Antonio; Irvine; Los Angeles," Financial Services, Financial Technology",https://stackoverflow.com//jobs/companies/capital-group?c=OF6icr3nzmd3cDtK&q=python&pg=4
PHOENIX CONTACT GmbH & Co. KG, Blomberg," Automotive, Electronics, Information Technology",https://stackoverflow.com//jobs/companies/phoenix-contact-gmbh-co-kg?c=OJugjc8s576Y382Y&q=python&pg=4
Andela, No office location," Agile Software Development, Software Development / Engineering, Technology Staffing",https://stackoverflow.com//jobs/companies/andela?c=NH9nnogIzlSQXTIk&q=python&pg=4
MBition (Mercedes Benz AG), Berlin," Agile Software Development, Automotive",https://stackoverflow.com//jobs/companies/mbition-mercedes-benz-ag?c=OHDqKEtJsUci8wla&q=python&pg=5
Dell Technologies, Seattle; Round Rock; Hopkinton," Hardware Engineering, Software Development / Engineering, Telecommunications",https://stackoverflow.com//jobs/companies/dell-technologies?c=OKaziRU5msbx4pcA&q=python&pg=5
LinkedIn, Beijing; New York; Sunnyvale," Advertising, Online Education, Social Networking",https://stackoverflow.com//jobs/companies/linkedin?c=OEOa3IA6JDKwtNQc&q=python&pg=5
Zühlke Engineering GmbH, Eschborn; München; Stuttgart," Agile Software Development, Enterprise Software, Software Development / Engineering",https://stackoverflow.com//jobs/companies/z%C3%BChlke-engineering-gmbh?c=M1eIKvQePSnYGCo8&q=python&pg=5
CREDIT SUISSE AG, London; Zürich; Navi Mumbai," Banking, Financial Services, Financial Technology",https://stackoverflow.com//jobs/companies/credit-suisse-ag?c=OI1BBBM5UwOkqXRe&q=python&pg=5
Vertica, Cambridge; Pittsburgh," Big Data, Enterprise Software, Information Technology",https://stackoverflow.com//jobs/companies/vertica?c=OIjJKkfmKfgR9NuM&q=python&pg=5
JPMorgan Chase & Co., Buenos Aires; Herzliya; Bengaluru, Financial Services,https://stackoverflow.com//jobs/companies/jpmorgan-chase-co?c=NjWXyu9b3NnEguru&q=python&pg=5
Canonical, Taipei City; London; Montreal," Cloud Computing, Information Technology, Internet of Things",https://stackoverflow.com//jobs/companies/canonical?c=NQTKJiFLHVdMoZDW&q=python&pg=5
Pentalog, Paris; Brooklyn; Zapopan," Agile Software Development, Digital Marketing, IT Recruitment",https://stackoverflow.com//jobs/companies/pentalog?c=N0WqpRswQbtlglYQ&q=python&pg=5
Discovery Direct-to-Consumer (Discovery Inc.), Knoxville; Sterling; New York," Broadcast, Digital Media, Digital Video Distribution",https://stackoverflow.com//jobs/companies/discovery-direct-to-consumer-discovery-inc?c=MQTUVeAcRTFT6qpG&q=python&pg=5
Flip App, Stuttgart," Agile Software Development, Messaging, Mobile Application",https://stackoverflow.com//jobs/companies/flip-app?c=OJ02K0101Alqb4Eo&q=python&pg=6
Lufthansa Industry Solutions, Wolfsburg; Wetzlar; Stuttgart, IT Consulting,https://stackoverflow.com//jobs/companies/lufthansa-industry-solutions?c=OK4wAD4ZKy21uNk4&q=python&pg=6
Zuhlke Engineering Ltd, Manchester; Edinburgh; London," Consulting, Software Development / Engineering",https://stackoverflow.com//jobs/companies/zuhlke-engineering-ltd?c=qiKaHRn4OrOvUtIQ&q=python&pg=6
BAE Systems Digital Intelligence, Manchester; Brockworth; Leeds," Cybersecurity, Defence & Security",https://stackoverflow.com//jobs/companies/bae-systems-digital-intelligence?c=OGX7KYI6bz7J7fby&q=python&pg=6
Adevinta, Barcelona; Paris, Information Technology,https://stackoverflow.com//jobs/companies/adevinta?c=O3toM8YrzL0tuO4w&q=python&pg=6
funda, Amsterdam," eCommerce, Information Technology",https://stackoverflow.com//jobs/companies/funda-real-estate-bv?c=Jpk1zn6UkvD5EOSQ&q=python&pg=6
Delivery Hero SE, Berlin," eCommerce, Food & Beverage, Logistics & Distribution",https://stackoverflow.com//jobs/companies/delivery-hero-se?c=sgMY3d4ognQ71oB2&q=python&pg=6
Apple, Cupertino; Austin; Haifa, Consumer Electronics,https://stackoverflow.com//jobs/companies/apple?c=smlsIQ2y70A8LdIs&q=python&pg=6
Zuhlke Engineering EOOD, Sofia," Agile Software Development, Computer Software",https://stackoverflow.com//jobs/companies/zuhlke-engineering-eood?c=M1wQTejvFAQvps1G&q=python&pg=6
MOIA GmbH, Berlin; Hamburg," Automotive, Mobility Services, ridesharing",https://stackoverflow.com//jobs/companies/moia-gmbh?c=JMwroherQ48ime9G&q=python&pg=6
Ford Motor Company, Dearborn; Palo Alto; Detroit," Automotive, Transportation",https://stackoverflow.com//jobs/companies/ford-motor-company?c=OGsUbMAE82mbfbMY&q=python&pg=7
Abbott, California; Orlando; Bend, Healthcare,https://stackoverflow.com//jobs/companies/abbott?c=OH3atdxbNtheGR44&q=python&pg=7
PayPay Corporation., No office location, Financial Technology,https://stackoverflow.com//jobs/companies/paypay-corporation?c=LGtoLAjXBXIvlu6c&q=python&pg=7
3M Health Information Systems and The Digital Science Community , Albany; Silver Spring; Pittsburgh," Digital Health, Enterprise Software, Software Development / Engineering",https://stackoverflow.com//jobs/companies/3m-health-information-systems-and-the-digital-science-community?c=OHliBW0sDbJLpGHC&q=python&pg=7
Amazon Web Services (AWS), No office location," Cloud Computing, Cloud Services, Cloud-Based Solutions",https://stackoverflow.com//jobs/companies/amazon-web-services-aws?c=OIvPaNTxY3zSj1fO&q=python&pg=7
Fidelity Investments, Westlake; Salt Lake City; Durham," Finance, Financial Services, Financial Technology",https://stackoverflow.com//jobs/companies/fidelity-investments?c=OHVyTmX0iCEORlYI&q=python&pg=7
Northwestern Mutual, Milwaukee; New York," Financial Services, Financial Technology",https://stackoverflow.com//jobs/companies/northwestern-mutual?c=OJGlJFMDiVpZclO0&q=python&pg=7
"DICK'S Sporting Goods, Inc. ", No office location, Retail,https://stackoverflow.com//jobs/companies/dicks-sporting-goods-inc?c=OIU01LbUpGbUBsLS&q=python&pg=7
Luxoft , Wrocław; Gdańsk; Torino, IT Consulting,https://stackoverflow.com//jobs/companies/luxoft?c=OFoql9wEp4FzVt7i&q=python&pg=7
G DATA CyberDefense AG, Bochum," Cybersecurity, IT Security",https://stackoverflow.com//jobs/companies/g-data-cyberdefense-ag?c=OHPwb87UGIvjhK6c&q=python&pg=7
BAUHAUS AG, Mannheim," E-Commerce, Retail",https://stackoverflow.com//jobs/companies/bauhaus-ag?c=OJSra9qOwJJ0lzz2&q=python&pg=8
Bloomberg LP, New York; Princeton; London," Data & Analytics, Financial Technology, News",https://stackoverflow.com//jobs/companies/bloomberg?c=3NdBKWpogs5Te1LW&q=python&pg=8
Zühlke Engineering AG, Bern; Schlieren," Data Science, IT Security, Software Development / Engineering",https://stackoverflow.com//jobs/companies/z%C3%BChlke-engineering-ag?c=M18G2h19dYet70vC&q=python&pg=8
Commonwealth Bank, Sydney; Eveleigh," Banking, Financial Services, Financial Technology",https://stackoverflow.com//jobs/companies/commonwealth-bank?c=OGmRtxLyw8cFFzUs&q=python&pg=8
Audible, Newark; Cambridge; Seattle," Agile Software Development, Content Marketing, Web Technology",https://stackoverflow.com//jobs/companies/audible?c=c8xStPAHS03ypnb2&q=python&pg=8
Caterpillar Inc., Chicago; Peoria; Bengaluru," Internet of Things, Manufacturing, Software Development / Engineering",https://stackoverflow.com//jobs/companies/caterpillar-inc?c=OIdH25qh8l7lAbCg&q=python&pg=8
DraftKings, Boston; Las Vegas; Sofia," Marketplace, Software Development, Sports Technology",https://stackoverflow.com//jobs/companies/draftkings?c=hDV9h9nEVLaZQWsw&q=python&pg=8
PAYBACK, München; Wien; Köln," Bonusprogramm, Product Development, Software Development",https://stackoverflow.com//jobs/companies/PAYBACK?c=p24QSUn2qy2xor8k&q=python&pg=8
If P&C Insurance, Mölndal; Hvidovre; Espoo," Finance, Financial Services, Insurance",https://stackoverflow.com//jobs/companies/if-p-c-insurance?c=OtHaIsDN2ogt09Bm&q=python&pg=8
PwC, New York," Consulting, Product Development, Technology Consulting",https://stackoverflow.com//jobs/companies/pwc?c=BaOONdBVwmp4Gf1S&q=python&pg=8
Automation with Python,Cognizant Technology Solutions,,https://www.indeed.com/viewjob?jk=16099279315afd99&from=web&vjs=3
Junior Software Developer,Data Ductus,"Boston, MA",https://www.indeed.com/viewjob?jk=e2baaaa8500d23a2&from=web&vjs=3
Research Assistant 2 - Social,The Ohio State University,,https://www.indeed.com/viewjob?jk=01431e66656bdd13&from=web&vjs=3
Python Engineer,Highbrow-Tech,Remote,https://www.indeed.com/viewjob?jk=708c0fa500eb52c4&from=web&vjs=3
Data Analyst,TrueAccord,Remote,https://www.indeed.com/viewjob?jk=df57f832dca6d837&from=web&vjs=3
"Junior Analyst, Baseball Research & Development",Tampa Bay Rays,"Saint Petersburg, FL 33705",https://www.indeed.com/viewjob?jk=29e437e14944c0fd&from=web&vjs=3
Data Analyst,ThirdLove,"San Francisco, CA",https://www.indeed.com/viewjob?jk=3ad69a5aaa5a0ca3&from=web&vjs=3
Junior Quant Analyst VIE,Company Webcast,United States,https://www.indeed.com/viewjob?jk=593bf1deda2b7727&from=web&vjs=3
Full Stack Engineer (I),Frequence,Remote,https://www.indeed.com/viewjob?jk=53a099caf95c24b1&from=web&vjs=3
Junior Data Analyst,SynergisticIT,Minnesota,https://www.indeed.com/viewjob?jk=a21db17ff1cbc3c6&from=web&vjs=3
PHP\Python Developer,IQVIA,"Somerset, NJ",https://www.indeed.com/viewjob?jk=da85f599d02a438c&from=web&vjs=3
QA Engineer,Universal Music Group,,https://www.indeed.com/viewjob?jk=6e5d70bc79c000ef&from=web&vjs=3
Photovoltaic Embodied-Energy and Carbon Emissions Researcher...,National Renewable Energy Laboratory,,https://www.indeed.com/viewjob?jk=1445e3d6b50c7e5e&from=web&vjs=3
Quality Engineer,Federal Reserve Bank of Boston,,https://www.indeed.com/viewjob?jk=bd661f53a0947f1e&from=web&vjs=3
Data Analyst,"Gametime United, Inc.",Remote,https://www.indeed.com/viewjob?jk=b0de307e5d5e1f51&from=web&vjs=3
Data Analyst,Affinity Solutions,Remote,https://www.indeed.com/viewjob?jk=7dfe2a93dcf96908&from=web&vjs=3
"Project Manager, Data Ingestion",Nike,,https://www.indeed.com/viewjob?jk=e27c57f577953621&from=web&vjs=3
Manual QA,Patson USA,"Chicago, IL",https://www.indeed.com/viewjob?jk=20bc33882cda1966&from=web&vjs=3
"Middle/Senior QA Engineer (Europe, Remote)",INTEL 471,Remote,https://www.indeed.com/viewjob?jk=03c9925549fbf6b8&from=web&vjs=3
Software Engineer,Microsoft,,https://www.indeed.com/viewjob?jk=0db0add9277325e0&from=web&vjs=3
Instructor (Coding experience required),Coding with Kids,Remote in United States,https://www.indeed.com/viewjob?jk=929778e6fdbf7d54&from=web&vjs=3
Software Engineer,EasyPost,,https://www.indeed.com/viewjob?jk=88a65bbb727abfd0&from=web&vjs=3
PYTHON DEVELOPER,Nextshift,"Raritan, NJ",https://www.indeed.com/viewjob?jk=1ad4e031a54894fe&from=web&vjs=3
Software Developer,Frogslayer,"Remote in Austin, TX",https://www.indeed.com/viewjob?jk=aed1a59d4f59f452&from=web&vjs=3
"Threat Analyst, Adult Nudity & Sexual Activity (ANSA)",TikTok,,https://www.indeed.com/viewjob?jk=ea93db9c80d0046c&from=web&vjs=3
Assistant Trader,3Red Partners,"Miami, FL",https://www.indeed.com/viewjob?jk=2504e4bedcaf37ac&from=web&vjs=3
Junior Quantitative Trader,Valkyrie Trading,,https://www.indeed.com/viewjob?jk=e69bf11e9062987d&from=web&vjs=3
Automation Engineer- Python,Charles Schwab,"Westlake, TX",https://www.indeed.com/viewjob?jk=947d8b0b76c00dfb&from=web&vjs=3
Software Developer,Avant Healthcare Professionals,Remote,https://www.indeed.com/viewjob?jk=c2b0c6a30f57a47d&from=web&vjs=3
Systems Engineer,North Carolina State University,"Hybrid remote in Raleigh, NC",https://www.indeed.com/viewjob?jk=f8f3fcf21ce76d7c&from=web&vjs=3
Systems Engineer,Perkins Coie,,https://www.indeed.com/viewjob?jk=25604844b12c7b7d&from=web&vjs=3
Python Developer,Sofmen,"Saratoga, CA 95070",https://www.indeed.com/viewjob?jk=0b4f734af7890726&from=web&vjs=3
"Analyst, Vulnerability Management",Github,Remote,https://www.indeed.com/viewjob?jk=96fd59572e5e041a&from=web&vjs=3
Data Analyst,Olea Edge Analytics,"Austin, TX 78738",https://www.indeed.com/viewjob?jk=dc8b6cfc7af8dff3&from=web&vjs=3
QA Consultant,Deloitte,,https://www.indeed.com/viewjob?jk=42888ff8cc8d3b62&from=web&vjs=3
Data Analyst,Appriss,Remote,https://www.indeed.com/viewjob?jk=e10a158fad8c99cd&from=web&vjs=3
Junior Developer (Java or Python or .Net),Infosys,"Stamford, CT",https://www.indeed.com/viewjob?jk=64f0df0eabcc7595&from=web&vjs=3
Machine Learning Researcher - ACS Education Team,Apple,,https://www.indeed.com/viewjob?jk=491ef1969d5cac9c&from=web&vjs=3
Junior Programmer,Infodatix,"Provo, UT 84606",https://www.indeed.com/viewjob?jk=833602c1f79407cb&from=web&vjs=3
Engineer II - Networking,Live Nation,,https://www.indeed.com/viewjob?jk=774f2c98913e6dfd&from=web&vjs=3
"Associate CIA, A2C ProServe","Amazon Web Services, Inc.",Remote,https://www.indeed.com/viewjob?jk=c731a70d77697279&from=web&vjs=3
Data Analyst,Forian,Remote,https://www.indeed.com/viewjob?jk=c9405f1ea654f867&from=web&vjs=3
"Quantum Packaging Simulation Engineer, Quantum AI",Google,,https://www.indeed.com/viewjob?jk=2d379a805b260647&from=web&vjs=3
Customer Support Specialist,dbt Labs,Remote in United States,https://www.indeed.com/viewjob?jk=95b23e6b43ac153b&from=web&vjs=3
Student Employee - Continuous Online Monitoring (COLM) and S...,Electric Power Research Institute,,https://www.indeed.com/viewjob?jk=cf761e29d8f62e1c&from=web&vjs=3
Remote Python Developer,Nikola Motor Company,"Remote in Phoenix, AZ",https://www.indeed.com/viewjob?jk=8802fa060b8cb359&from=web&vjs=3
M365 Developer (Remote),Parsons,,https://www.indeed.com/viewjob?jk=0acc0ed0ccca9502&from=web&vjs=3
"SOFTWARE DEVELOPER, ASSOCIATE (Salary)",Parsons,,https://www.indeed.com/viewjob?jk=ee0cf970e09b8404&from=web&vjs=3
Research Technician,California Institute of Technology,,https://www.indeed.com/viewjob?jk=db95e9730d78491b&from=web&vjs=3
Technical Project Engineer (Zoom Phone & Contact Center),"Zoom Video Communications, Inc.",Remote,https://www.indeed.com/viewjob?jk=b71121881a85874e&from=web&vjs=3
Junior Developer,Atlantic Bay Mortgage Group,Remote,https://www.indeed.com/viewjob?jk=03b192cb190ce39c&from=web&vjs=3
Data Analyst,KEYENCE,"Itasca, IL 60143",https://www.indeed.com/viewjob?jk=4caf8019f6e4edf7&from=web&vjs=3
Quality Assurance Tester,Involve.ai,Remote,https://www.indeed.com/viewjob?jk=fb97ddfbcca3ef58&from=web&vjs=3
Python Developer,Aquatic Capital Management,"Remote in Chicago, IL",https://www.indeed.com/viewjob?jk=5bdb3c2265c60c4a&from=web&vjs=3
Associate Trader - Biofuel Credits,StoneX Group Inc. US,"Boca Raton, FL",https://www.indeed.com/viewjob?jk=027bfa95617ae03d&from=web&vjs=3
Equity Trader,Pacific Investment Management Company LLC,"New York, NY",https://www.indeed.com/viewjob?jk=448aaeaae12a93ee&from=web&vjs=3
Software Engineer - Backend,Gridwise,Remote,https://www.indeed.com/viewjob?jk=81cc6b844161bf4b&from=web&vjs=3
Software Engineer,Microsoft,,https://www.indeed.com/viewjob?jk=0db0add9277325e0&from=web&vjs=3
DevOps Engineer,Noodle,,https://www.indeed.com/viewjob?jk=c5ce04d227fa8aaf&from=web&vjs=3
Python Developer,Fults & Associates,"Grapevine, TX",https://www.indeed.com/viewjob?jk=724d43dd753723a7&from=web&vjs=3
Python Developer,Sofmen,"Saratoga, CA 95070",https://www.indeed.com/viewjob?jk=0b4f734af7890726&from=web&vjs=3
Remote Software Engineer (C++),Piper Companies,,https://www.indeed.com/viewjob?jk=da921f13fd4dc3f2&from=web&vjs=3
Software Engineer,Principal Financial Group,,https://www.indeed.com/viewjob?jk=efc73a3344dba915&from=web&vjs=3
Software Engineer - Backend/Python (100% Remote),Close.com,Remote,https://www.indeed.com/viewjob?jk=c52ab7b9e386624e&from=web&vjs=3
Software Development Engineer 2,Adobe,,https://www.indeed.com/viewjob?jk=c816b410e9f8cf14&from=web&vjs=3
Python Developer,Hitachi,"Waltham, MA",https://www.indeed.com/viewjob?jk=d352cca43f384450&from=web&vjs=3
Web Developer,Academy of Art University,Remote,https://www.indeed.com/viewjob?jk=695ea928882b5677&from=web&vjs=3
Software Developer- Python,PNC Financial Services Group,,https://www.indeed.com/viewjob?jk=2c1d77a35e4eba4d&from=web&vjs=3
Backend Developer - Business Operations,Druva,,https://www.indeed.com/viewjob?jk=6f0e15e79bfbd094&from=web&vjs=3
"Senior Backend Engineer, Model Training",Labelbox,,https://www.indeed.com/viewjob?jk=37ae129341dfc1ec&from=web&vjs=3
L'Oréal Travel Retail Americas- Data Analyst,L'Oreal,"Miami, FL",https://www.indeed.com/viewjob?jk=457ff131f235cc17&from=web&vjs=3
Junior AI/Data Scientist,ViQi,"Remote in Santa Barbara, CA",https://www.indeed.com/viewjob?jk=66a74419258ae64b&from=web&vjs=3
Automation Engineer- Python,Charles Schwab,"Westlake, TX",https://www.indeed.com/viewjob?jk=947d8b0b76c00dfb&from=web&vjs=3
Junior-Mid Software Developer,Aeries Software,Remote in United States,https://www.indeed.com/viewjob?jk=44c9be14a1cc0f31&from=web&vjs=3
Cloud Support Apprenticeship,IBM,,https://www.indeed.com/viewjob?jk=4e2d2063b05de5dc&from=web&vjs=3
Business Data Analyst - 4287352,Accenture,,https://www.indeed.com/viewjob?jk=49911733ed00ba0e&from=web&vjs=3
SPG Research- Analyst,"JPMorgan Chase Bank, N.A.","New York, NY",https://www.indeed.com/viewjob?jk=04b778770a4cb696&from=web&vjs=3
Data Scientist II Remote,Sovrn Holdings,Remote,https://www.indeed.com/viewjob?jk=d34d07bf42fc369a&from=web&vjs=3
Research Associate,Harvard University,"Boston, MA",https://www.indeed.com/viewjob?jk=845d9019fe86ddf3&from=web&vjs=3
Python Developer,TeleWorld Solutions Inc,"Plano, TX 75023",https://www.indeed.com/viewjob?jk=4e2900e6012cdf2e&from=web&vjs=3
48th NSBE National Convention - APPLICATION DROP,Electronic Arts,,https://www.indeed.com/viewjob?jk=0ed54ccd28405317&from=web&vjs=3
Automation with Python,Cognizant Technology Solutions,,https://www.indeed.com/viewjob?jk=16099279315afd99&from=web&vjs=3
"Senior Software Engineer, Python",Restaurant Brands International,"Hybrid remote in Miami, FL",https://www.indeed.com/viewjob?jk=60a16f486cb02283&from=web&vjs=3
ML Engineer,AtScale,"Boston, MA",https://www.indeed.com/viewjob?jk=4af7b005d2124bca&from=web&vjs=3
Trader,Federated Hermes,,https://www.indeed.com/viewjob?jk=a39db78eb66a39be&from=web&vjs=3
"Data Analyst, Core Analytics",Blizzard Entertainment,,https://www.indeed.com/viewjob?jk=4a0f149cbdd05f49&from=web&vjs=3
Python Developer [Remote],Braintrust,,https://www.indeed.com/viewjob?jk=cc424505f92ecdb7&from=web&vjs=3
Decision Scientist - Multiple Roles,The Walt Disney Company (Corporate),,https://www.indeed.com/viewjob?jk=3c71ab0971eaf694&from=web&vjs=3
Python (Django/Flask) Developer,Trood,,https://www.indeed.com/viewjob?jk=a5fe3ba2a2ecdbe2&from=web&vjs=3
Business Analyst (Entry Level),Agama Solutions,,https://www.indeed.com/viewjob?jk=7a2f9cc2cc982a1e&from=web&vjs=3
Senior Python Developer,Ollanna,"San Francisco, CA",https://www.indeed.com/viewjob?jk=afd26d98ba52ad14&from=web&vjs=3
Display Technologist,Apple,,https://www.indeed.com/viewjob?jk=de0f56fb6acc3a4c&from=web&vjs=3
Remote Python Developer,Nikola Motor Company,"Remote in Phoenix, AZ",https://www.indeed.com/viewjob?jk=8802fa060b8cb359&from=web&vjs=3
"Senior Engineer, Software (Python)",Verint Systems Inc.,Remote,https://www.indeed.com/viewjob?jk=cf6a0a2846bcd8e7&from=web&vjs=3
Ad Operations Associate – Publishers,AT&T,California,https://www.indeed.com/viewjob?jk=6e10a77453b3452d&from=web&vjs=3
Business Analyst (Remote-LatAm),Loadsmart,Remote,https://www.indeed.com/viewjob?jk=3444c564d07b19ad&from=web&vjs=3
Sr. Cell Testing Engineer,Panasonic Energy of North America,"Sparks, NV 89437",https://www.indeed.com/viewjob?jk=15db14e475723eaf&from=web&vjs=3
