Place,Title,Time,Payday,Pay,Date
경기 시흥시,목구멍 삼겹살 시흥점 매니저 모집,15:00~01:00,월급,"2,900,000",25분전
경기 시흥시,목구멍 삼겹살 시흥점 파트타임 (설거지)알바 모집(월화수목 및금토일),19:00~23:00,월급,"10,000",26분전
부산 동구,설거지 알바 및 주방직원을 모집합니다. (외국인가능),18:00~22:30,월급,"11,000",34분전
경기 안양시,홀직원 함께 할 인재를 찾아요,시간 협의,월급,"2,500,000",35분전
경기 하남시,목구멍 하남점에서 오픈 멤버를 모집합니다. (직원),15:00~24:00,월급,"2,900,000",1시간전
부산 중구,목구멍남포점 정직원구합니다,15:00~01:00,월급,"2,720,000",2시간전
부산 중구,목구멍남포점 정직원구합니다,15:00~01:00,월급,"2,720,000",2시간전
대전 유성구,대전 관평동 목구멍 관평점 직원 및 알바 모집합니다),시간 협의,월급,"3,100,000",3시간전
경기 남양주,"목구멍 남양주 별내점 주방실장, 직원 구해요(+알바)",시간 협의,월급,"3,000,000",3시간전
경기 남양주,"목구멍 남양주 별내점 주방실장, 직원 구해요(+알바)",시간 협의,월급,"3,000,000",3시간전
경기 남양주,"목구멍 남양주 별내점 주방실장, 직원 구해요(+알바)",시간 협의,월급,"3,000,000",3시간전
광주 서구,상무지구 목구멍에서 직원 모집합니다,03:00~12:30,월급,"2,600,000",3시간전
광주 서구,상무지구 목구멍에서 직원 모집합니다,03:00~12:30,월급,"2,600,000",3시간전
대전 대덕구,목구멍에서 주방직원  &  홀에서 고기구워주는  알바모집합니다.,04:00~00:00,월급,"9,500",3시간전
대전 대덕구,목구멍에서 주방직원  &  홀에서 고기구워주는  알바모집합니다.,04:00~00:00,월급,"9,500",3시간전
대전 대덕구,목구멍에서 주방직원  &  홀에서 고기구워주는  알바모집합니다.,04:00~00:00,월급,"9,500",3시간전
경남 거제시,아주동 목구멍본점 홀/서빙 알바생 모집합니다,18:00~22:00,월급,"11,000",3시간전
경남 거제시,아주동 목구멍본점 홀/서빙 알바생 모집합니다,18:00~22:00,월급,"11,000",3시간전
경기 화성시,목구멍 화성점 아르바이트 및 직원  모집 합니다,18:00~22:00,월급,"11,000",3시간전
경기 화성시,목구멍 화성점 아르바이트 및 직원  모집 합니다,18:00~22:00,월급,"11,000",3시간전
대구 동구,목구멍  []대구 동구 신세계점[] 함께 하실분,17:00~00:30,월급,"10,000",3시간전
대구 동구,목구멍  []대구 동구 신세계점[] 함께 하실분,17:00~00:30,월급,"10,000",3시간전
대구 동구,목구멍  []대구 동구 신세계점[] 함께 하실분,17:00~00:30,월급,"10,000",3시간전
부산 해운대,목구멍 반여점에서 함께 일할실 주방 직원 모집합니다,14:00~24:00,월급,"2,700,000",3시간전
부산 해운대,목구멍 반여점에서 함께 일할 주방보조 모집합니다,18:00~22:00,월급,"10,000",3시간전
경기 안성시,목구멍  안성점  홀서빙 아르바이트 채용,15:00~22:00,월급,"10,500",3시간전
경기 안성시,목구멍  안성점  홀서빙 아르바이트 채용,15:00~22:00,월급,"10,500",3시간전
경기 안성시,목구멍 안성점 설거지 아르바이트 채용,17:00~22:00,월급,"11,000",3시간전
울산 남구,울산 삼산 목구멍 가족같은 분위기로 일하실 직원채용합니다,16:00~01:30,월급,"2,800,000",3시간전
울산 남구,울산 삼산 목구멍 아르바이트생 모집 (10500),시간 협의,월급,"10,500",3시간전
부산 중구,목구멍남포점 아르바이트 구합니다,18:00~22:00,월급,"10,000",3시간전
부산 해운대,목구멍 해운대점에서 함께할 알바 모집합니다,시간 협의,월급,"12,000",3시간전
부산 해운대,목구멍 해운대점에서 직원 및 알바 모집합니다,시간 협의,월급,"2,700,000",3시간전
대전 중구,"대전 목구멍 대흥점,오류점 직원/아르바이트 모집",시간 협의,월급,"9,500",3시간전
대전 중구,"대전 목구멍 대흥점,오류점 직원/아르바이트 모집",시간 협의,월급,"9,500",3시간전
대전 중구,"대전 목구멍 대흥점,오류점 직원/아르바이트 모집",시간 협의,월급,"9,500",3시간전
경기 오산시,목구멍 오산점  홀알바  및 홀직원 구합니다,18:00~22:00,월급,"11,000",4시간전
경기 오산시,목구멍 오산점  홀알바  및 홀직원 구합니다,18:00~22:00,월급,"11,000",4시간전
경기 부천시,"경기부천시/평일/주간/주말/고기집 주방보조,점장,주방이모 직원및알바 나이무관",19:00~24:00,월급,"10,000",4시간전
부산 남구,대연점 목구멍 정직원 구합니다,15:00~01:00,월급,"9,500",5시간전
