Place,Title,Time,Payday,Pay,Date
서울 관악구,"올리브영 신림점 평일 마감(월,화,수,목) MATE 모집",17:00~22:00,월급,"9,160",1분전
경기 양주시,올리브영 양주덕정점 주말마감 MATE 구인(급구),16:00~22:00,월급,"9,160",2분전
서울 서초구,"올리브영 방배점 평일(월,화,수,목,금) 미들 MATE 구인",12:00~18:00,월급,"9,160",7분전
서울 서초구,올리브영 방배점 평일 단기 MATE 구인 (시간 협의가능),14:00~21:00,월급,"9,160",8분전
서울 서초구,올리브영 방배점 평일 단기 MATE 구인 (시간 협의가능),14:00~21:00,월급,"9,160",13분전
대구 북구,올리브영 경북대점 평일 미들 MATE 모집,시간 협의,월급,"9,160",18분전
전북 군산시,올리브영 군산조촌점 평일 미들 MATE 구인합니다,14:00~20:00,월급,"9,160",21분전
부산 부산진,올리브영 서면 타운 평일 미들 MATE 구인,12:00~18:00,월급,"9,160",21분전
부산 부산진,올리브영 서면 타운 주말 마감 MATE 구인,15:30~23:00,월급,"9,160",22분전
부산 북구,올리브영 덕천중앙점 주말 미들 MATE 구인합니다.,15:00~21:30,월급,"9,160",23분전
부산 부산진,올리브영 서면 타운 평일 마감 MATE 구인,16:00~23:00,월급,"9,160",24분전
경기 용인시,올리브영 용인기흥점 주말 마감 MATE 구인,16:00~22:00,월급,"9,160",24분전
경기 용인시,올리브영 용인기흥점 주말 오픈 MATE 구인,09:30~16:30,월급,"9,160",27분전
인천 서구,"올리브영 인천신현점 화,수 마감 MATE 구인",16:00~22:30,월급,"9,160",27분전
서울 은평구,올리브영 연신내범서점 평일 마감 MATE 구인,17:00~23:00,월급,"9,160",28분전
전남 여수시,CJ올리브영 여수웅천마리나점 주말 MATE 구인,시간 협의,월급,"9,160",28분전
울산 남구,CJ 올리브영 울산대로점 평일 미들 메이트 구인,11:30~17:00,월급,"9,160",33분전
서울 전체,올리브영 신사점 주말 마감 MATE 구인(토일),16:00~22:30,월급,"9,160",33분전
서울 전체,올리브영 신사점 주말 마감 MATE 구인(금토일),16:00~22:30,월급,"9,160",34분전
서울 강동구,올리브영 강일동점 화목금 오픈 메이트 구인합니다.,09:30~14:00,월급,"9,160",34분전
경기 김포시,올리브영 김포감정점 평일미들 MATE 모집,14:00~19:00,월급,"9,160",36분전
경기 시흥시,"올리브영 시흥은계점 화,목,토,일 오전 MATE 구인",11:30~17:00,월급,"9,160",39분전
서울 영등포,올리브영 영등포역점 평일마감 MATE 구인,17:00~23:00,월급,"9,160",39분전
경기 시흥시,올리브영 시흥은계점 주말 미들 MATE 구인,14:00~20:30,월급,"9,160",41분전
대구 달서구,CJ올리브영 대구서부정류장점 주말 미들 MATE 구인,14:00~20:00,월급,"9,160",44분전
제주 서귀포,올리브영 서귀포광장점 월/화/수/목 오픈 MATE 구인,10:30~18:00,월급,"9,160",44분전
제주 서귀포,올리브영 서귀포광장점 월/화/수/목 마감 MATE 구인,16:00~22:00,월급,"9,160",44분전
대구 중구,올리브영 대구동성로점 평일 미들 MATE 채용,15:00~20:00,월급,"9,160",45분전
서울 전체,올리브영 신사점 주말 마감 MATE 구인(금토일),16:00~22:30,월급,"9,160",54분전
서울 강남구,올리브영 강남중앙점 주말 오픈 MATE 구인(강남역 4번출구),시간 협의,월급,"9,160",56분전
경기 수원시,올리브영 수원 타운 평일마감 MATE 모집,17:30~23:00,월급,"9,160",56분전
서울 강남구,올리브영 강남중앙점 마감 MATE 구인(월화수 or 목금토),15:00~22:30,월급,"9,160",1시간전
서울 용산구,올리브영 이태원중앙점 화금토일 오픈 구인,10:30~16:30,월급,"9,160",1시간전
전북 전주시,올리브영 전주송천점 주말 오픈 MATE 구인,09:30~17:00,월급,"9,160",1시간전
서울 영등포,"CJ올리브영 타임스퀘어아트리움점 주말오픈 토,일,월 MATE 구인",시간 협의,월급,"9,160",1시간전
서울 전체,올리브영 서초대로점 평일 미들 MATE 모집,시간 협의,월급,"9,160",1시간전
부산 금정구,CJ 올리브영 부산대역점 평일 오픈 메이트 구인,09:30~16:00,월급,"9,160",1시간전
서울 전체,"[급구]올리브영 신강남점 평일 마감(월,화,수,목) MATE 모집",16:30~22:30,월급,"9,160",1시간전
서울 전체,"[급구]올리브영 신강남점 평일 마감(월,화,수,목) MATE 모집",17:00~22:30,월급,"9,160",1시간전
서울 전체,"[급구]올리브영 신강남점 금,토,일 마감 MATE 모집",17:00~22:30,월급,"9,160",1시간전
