Place,Title,Time,Payday,Pay,Date
경기 광명시,하남돼지집 광명역점 주방보조 직원 채용,15:00~24:00,월급,"2,600,000",1분전
서울 영등포,하남돼지집 문래점  주5일 근무  직원  모집합니다,15:00~23:00,월급,"2,400,000",4분전
서울 성북구,하남돼지집 정릉점 아르바이트모집,18:00~21:30,월급,"9,500",4분전
서울 영등포,하남돼지집 문래점 정직원 모집합니다,15:00~23:00,월급,"2,700,000",4분전
서울 성북구,하남돼지집 정릉점 아르바이트모집,18:00~21:30,월급,"9,500",5분전
경기 고양시,하남돼지집 웨스턴돔점 아르바이트 모집합니다.(주4회 18시-22시),18:00~22:00,월급,"10,000",5분전
서울 성북구,하남돼지집 정릉점 아르바이트모집,18:00~21:30,월급,"9,500",5분전
경기 안산시,홀직원 모집,시간 협의,월급,"2,600,000",8분전
경기 안양시,홀서빙정직원or 오후홀서빙알바 주2일(금/일) 하남돼지집 안양일번가점,시간 협의,월급,"10,000",33분전
경기 고양시,하남돼지집 일산킨텍스점 주방보조 직원을 모십니다 (초보자 가능),16:00~22:00,월급,"2,400,000",47분전
경기 고양시,하남돼지집 일산킨텍스점 홀 직원을 모집합니다(초보자 가능),16:00~23:00,월급,"2,700,000",48분전
경기 고양시,"하남돼지집 일산킨텍스점 아르바이트 모집합니다 (초보자 가능)시급12,500원",18:00~20:00,월급,"12,500",48분전
경기 고양시,하남돼지집 일산킨텍스점 점장 모집합니다 (월300),16:00~23:00,월급,"3,000,000",48분전
서울 노원구,하남돼지집 중계점 아르바이트 모집 급구,18:00~21:00,월급,"10,000",1시간전
서울 성북구,"하남돼지집  월곡역점 주방.홀직원.알바 (260만원~270 ,시급10000)",02:00~23:00,월급,"2,600,000",1시간전
서울 종로구,"시급11,400원(주휴포함)/월~토/하남돼지집 광화문점 홀 아르바이트 모집",18:00~22:00,월급,"11,400",2시간전
경기 용인시,하남돼지집 용인역북점에서 알바모집합니다,시간 협의,월급,"10,000",2시간전
서울 강남구,선릉1호점 야간 17~05 홀 서빙 하실분,17:00~05:00,월급,"2,900,000",2시간전
서울 중랑구,하남돼지집 면목점 주말포함 3일 서빙알바 모집합니다 9500~10000원,17:00~22:00,월급,"9,500",2시간전
서울 중랑구,하남돼지집 면목점 정직원 모집합니다 8시간 근무 월 240만,15:00~24:00,월급,"2,400,000",2시간전
서울 강남구,선릉1호점 야간 17~05 홀 서빙 하실분,17:00~05:00,월급,"2,900,000",2시간전
인천 부평구,하남돼지집 인천삼산점 주방 (직원)  모집합니다,15:00~23:30,월급,"2,750,000",2시간전
인천 부평구,하남돼지집 인천삼산점 주방 모집합니다,15:00~23:30,월급,"2,750,000",2시간전
경기 하남시,하남돼지집 스타필드점 주말 파트 및 직원 구합니다.,16:00~00:30,월급,"2,400,000",3시간전
경기 하남시,[270~280만] 정직원 채용합니다,14:00~23:00,월급,"2,800,000",3시간전
경기 하남시,[270~280만] 정직원 채용합니다,14:00~23:00,월급,"2,800,000",3시간전
경기 부천시,"하남돼지집 부천중동점에서 알바를 모집합니다.(주휴포함시급11,600원)",18:00~22:00,월급,"11,600",3시간전
경기 부천시,"하남돼지집 부천중동점에서 알바를 모집합니다.(주휴포함시급11,600원)",18:00~22:00,월급,"11,600",3시간전
경기 부천시,"하남돼지집 부천중동점에서 주방설거지,보조직원을 모집합니다.",15:00~02:00,월급,"2,600,000",3시간전
경기 부천시,"하남돼지집 부천중동점에서 주방설거지,보조직원을 모집합니다.",15:00~02:00,월급,"2,600,000",3시간전
서울 노원구,하남돼지집 중계점 아르바이트 모집 급구,18:00~21:00,월급,"10,000",3시간전
경기 안산시,하남돼지고잔점(금.토.일)or(목금토일)알바 구함,18:00~23:00,월급,"10,500",3시간전
경기 용인시,용인보정점 하남돼지집 주말 알바 모집합니다.,18:00~22:00,월급,"12,000",4시간전
경기 시흥시,하남돼지집시흥능곡역점에서  홀  알바 모집 합니다,시간 협의,월급,"10,000",4시간전
경기 시흥시,하남돼지집시흥능곡역점에서  홀  알바 모집 합니다,시간 협의,월급,"10,000",4시간전
경기 용인시,하남 돼지집 용인 보정점에서 같이할 홀 직원 채용합니다.,시간 협의,월급,"2,600,000",4시간전
경기 하남시,하남 돼지집 미사역점 홀 알바 모집,17:00~23:30,월급,"11,000",4시간전
서울 노원구,하남돼지집 노원하계점에서 정예멤버를 구합니다.,15:00~24:00,월급,"2,300,000",5시간전
경기 고양시,하남돼지집 웨스턴돔점 직원 모집합니다(17시-23시 6시간근무),17:00~23:00,월급,"1,900,000",6시간전
서울 중랑구,하남돼지집 면목점 정직원 모집합니다 8시간 근무 월 240만,15:00~24:00,월급,"2,400,000",6시간전
