Place,Title,Time,Payday,Pay,Date
서울 용산구,홈플러스익스프레스 한남점 파트타임/아르바이트 모집,13:00~19:00,월급,"9,160",32분전
서울 송파구,홈플러스 개롱점 영업사원구인 07:00~14:00 6월2일 근무 1년계약,시간 협의,월급,"9,160",38분전
경기 광명시,홈플러스 익스프레스 마감 영업 인원 모집,18:00~24:00,월급,"9,160",55분전
경기 안양시,홈플러스 익스프레스 안양평촌점 직원 모집(직영),17:00~23:00,월급,"9,160",1시간전
경기 수원시,홈플러스익스프레스 연무점에서 같이 일할 직원(TW) 구인합니다.,12:00~18:00,월급,"9,160",2시간전
경기 안성시,홈플러스 안성공도점 직원채용,시간 협의,월급,"9,160",3시간전
경기 시흥시,홈플러스슈퍼 시흥정왕2점단기3개월 마감 18시~24시/150만이상,18:00~24:00,월급,"9,160",3시간전
인천 서구,홈플러스 익스프레스 인천중앙점에서 함께하실 직원을 모집합니다,15:00~21:00,월급,"9,160",3시간전
경기 화성시,홈플러스 익스프레스 화성반월점에서 함께하실 분을 찾습니다. (5H 정직원),14:00~20:00,월급,"9,160",3시간전
경기 화성시,홈플러스 익스프레스 화성반월점에서 함께하실 분을 찾습니다.(5H 아르바이트),15:00~21:00,월급,"9,160",3시간전
인천 연수구,홈플러스 익스프레스 인천송도점(오전알바),08:00~14:00,월급,"9,160",4시간전
경기 수원시,홈플러스익스프레스 수원이의점 계약선임 (1년이상) 정규직전환,18:00~24:00,월급,"9,160",4시간전
경기 수원시,홈플러스익스프레스 수원이의점 계약선임 (1년이상) 정규직전환,18:00~24:00,월급,"9,160",4시간전
경기 수원시,홈플러스익스프레스 수원이의점 계약선임 (1년이상) 정규직전환,18:00~24:00,월급,"9,160",4시간전
부산 해운대,홈플러스 익스프레스 동부점에서 신규 직원을 모집 채용 합니다.,16:00~22:00,월급,"9,160",4시간전
서울 송파구,홈플러스 익스프레스 삼전역점 중간타임 직원 구합니다.,13:00~19:00,월급,"9,160",4시간전
경기 성남시,홈플러스익스프레스 분당 동판교점  마감 근무 직원 모집,17:00~24:00,월급,"9,160",4시간전
경기 성남시,홈플러스익스프레스 분당 동판교점  마감 근무 직원 모집,17:00~24:00,월급,"9,160",4시간전
경기 용인시,홈플러스익스프레스 분당 동판교점  마감 근무 직원 모집,17:00~24:00,월급,"9,160",4시간전
경기 용인시,홈플러스익스프레스 분당 동판교점  마감 근무 직원 모집,17:00~24:00,월급,"9,160",4시간전
서울 중랑구,홈플러스 익스프레스 면목점 단기알바 구인 (2022년 7월 31일까지),14:00~20:00,월급,"9,160",4시간전
서울 강남구,홈플러스 익스프레스 도곡2점 오전 영업직원 모집합니다,09:00~16:00,월급,"9,160",4시간전
인천 연수구,홈플러스 익스프레스 인천송도점(오전알바),08:00~14:00,월급,"9,160",4시간전
경기 의왕시,홈플러스익스프레스 의왕포일점 아르바이트 모집.,시간 협의,월급,"9,160",4시간전
경기 수원시,홈플러스익스프레스 화서점에서 단기 아르바이트 구인 합니다.,08:00~02:00,월급,"9,160",4시간전
서울 강남구,홈플러스익스프레스 대치점 영업/케셔 직원 각 1명씩 구인합니다.,시간 협의,월급,"9,160",5시간전
경기 군포시,"홈플러스 익스프레스 군포오금점에서 근무하실 직원구합니다(오전, 마감진열)",18:00~24:00,월급,"9,160",5시간전
경기 군포시,"홈플러스 익스프레스 군포오금점에서 근무하실 직원구합니다(오전, 마감진열)",18:00~24:00,월급,"9,160",5시간전
서울 성동구,홈플러스 익스프레스 옥수점 1년이상 구인,08:00~14:00,월급,"9,160",5시간전
서울 송파구,홈플러스 익스프레스 거여점에서 3개월간 함께일하실 1분 구인합니다.,15:00~21:00,월급,"9,160",5시간전
경기 성남시,홈플러스 익스프레스 분당정자점에서 책임감 있는 야간 멀티직원 구합니다.,18:00~24:00,월급,"9,160",5시간전
서울 영등포,홈플러스익스프레스 신길점에 야간 인원 모집합니다.,17:00~24:00,월급,"9,160",6시간전
서울 성동구,"홈플러스 익스프레스 왕십리점(왕십리역, 상왕십리역)",시간 협의,월급,"9,160",6시간전
대전 중구,홈플러스익스프레스  오류점  직원구인(계약선임),17:00~24:00,월급,"1,712,920",6시간전
서울 서초구,홈플러스 익스프레스 서초점에서 함께 근무 할 직원(상품진열)을 모집합니다.,시간 협의,월급,"9,160",6시간전
경기 고양시,홈플러스익스프레스 정발산점 아르바이트 구인,시간 협의,월급,"9,160",6시간전
경기 수원시,홈플러스익스프레스 연무점에서 같이 일할 직원 구인합니다.(6/2 입사),07:00~13:00,월급,"9,160",7시간전
서울 영등포,홈플러스익스프레스 신길점에 야간 인원 모집합니다.,17:00~24:00,월급,"9,160",7시간전
서울 중랑구,홈플러스 익스프레스 면목점 단기알바 구인 (2022년 7월 31일까지),14:00~20:00,월급,"9,160",7시간전
경기 평택시,"홈플러스 익스프레스 평택청북점 아르바이트,직원 채용",시간 협의,월급,"9,160",7시간전
